{
  "schema": "agentswitchboard.public-plan.v1",
  "planId": "ASB-2026-09-STALE-PR-TRIAGE-01",
  "title": "Stale open PR triage disposition plan (POST-PPP TRIAGE-01)",
  "repository": "EndeavorEverlasting/AgentSwitchboard",
  "visibility": "public",
  "status": "active",
  "priority": "high",
  "createdUtc": "2026-09-19T16:30:00Z",
  "updatedUtc": "2026-09-19T17:18:00Z",
  "mission": "Systematically analyze 47 open PRs from July-September 2026 era, assign evidence-based dispositions (keep/rebase/superseded/close-candidate), document containment proof for superseded PRs, and produce actionable triage guidance for repository operator. Does NOT close, merge, or comment on PRs.",
  "owner": {
    "surface": "coordination",
    "role": "PR triage lane",
    "agent": "cloud-agent-triage-01"
  },
  "delivery": {
    "branch": "cursor/triage-01-stale-pr-dispositions-1bb2",
    "pullRequest": {
      "number": 312,
      "url": "https://github.com/EndeavorEverlasting/AgentSwitchboard/pull/312",
      "state": "merged"
    },
    "baseRef": "main@8e96082",
    "commitRequired": true
  },
  "wave": "POST-PPP",
  "lane": "coordination-triage",
  "dependencies": [
    "ASB-2026-09-POST-PPP-REMAINING-SPRINTS"
  ],
  "safeParallelWork": [
    "ASQ-017 Admin Box physical floor (host-isolated)"
  ],
  "ownedScope": [
    "plans/active/ASB-2026-09-stale-pr-triage-01.plan.json",
    "plans/active/ASB-2026-09-stale-pr-triage-01.md",
    "plans/plan-registry.json (if main owns registry)"
  ],
  "forbiddenScope": [
    "PR closes, merges, comments, rebases, force-pushes",
    "Auto-merge enabling",
    "GitHub write operations via gh CLI",
    "Secrets, credentials, machine paths",
    "Live system mutations",
    "Claiming merge authority"
  ],
  "expectedArtifacts": [
    "ASB-2026-09-stale-pr-triage-01.plan.json (schema-compliant, no prDispositions)",
    "ASB-2026-09-stale-pr-triage-01.md (human summary with full per-PR disposition detail)",
    "plan-registry.json update"
  ],
  "tasks": [
    {
      "taskId": "TRIAGE-PR-ANALYSIS",
      "title": "Analyze all 47 open PRs and assign evidence-based dispositions",
      "status": "completed",
      "owner": "triage-lane",
      "dependencies": [],
      "inputs": [
        "gh pr list open output",
        "git log origin/main commits since 2026-07-14",
        "PR #308 body (FirstMate supersession evidence)",
        "main@8e96082 file tree inspection"
      ],
      "outputs": [
        "Per-PR disposition assignments (47 PRs)",
        "Containment proof for superseded PRs",
        "Cluster analysis (July GNHF, Aug harness/Android, Sept floor, current)"
      ],
      "acceptanceCriteria": [
        "All 47 PRs analyzed",
        "Dispositions evidence-based (not guessed)",
        "Superseded PRs cite containment commits/PRs",
        "Close-candidates cite obsolescence rationale",
        "Rebase candidates cite merge conflicts",
        "Full detail recorded in ASB-2026-09-stale-pr-triage-01.md"
      ],
      "evidence": [
        "PR #308 faac296 explicitly supersedes #96, notes #96-#101 for closure",
        "main@8e96082 contains FirstMate harness, Android Termux harness, WSL bootstrap, GNHF skill",
        "DeepSeek work on main via PR #21 (4c5c902), #145 (d2bafc7/d1f2a90)",
        "Android Herdr abandoned per commit 7c7f2da",
        "PRs #154, #159 merge status: CONFLICTING",
        "July GNHF PRs predate ASQ-004 Sept floor + FirstMate boundary",
        "Aug harness PRs: none merged, work evolved differently on main",
        "Disposition counts: keep=2, rebase=2, superseded=6, close-candidate=37, blocked=0"
      ]
    },
    {
      "taskId": "CREATE-DISPOSITION-PLAN",
      "title": "Create machine-readable plan.json (schema-compliant)",
      "status": "completed",
      "owner": "triage-lane",
      "dependencies": [
        "TRIAGE-PR-ANALYSIS"
      ],
      "inputs": [
        "Per-PR disposition analysis",
        "public-plan.schema.json requirements (additionalProperties: false)"
      ],
      "outputs": [
        "ASB-2026-09-stale-pr-triage-01.plan.json (no prDispositions top-level field)",
        "Disposition summary in handoff.notes"
      ],
      "acceptanceCriteria": [
        "Schema-valid per public-plan.schema.json",
        "No additionalProperties violations",
        "Disposition summary with counts in handoff.notes",
        "Full per-PR detail preserved in markdown"
      ],
      "evidence": [
        "plan.json omits plan-specific prDispositions from the closed public-plan root; full per-PR detail remains in the markdown summary",
        "Public plan and startup readiness contracts workflow 35457635946 succeeded on head d0e175c4545f2a76331f08c606429da5c4711d41"
      ]
    },
    {
      "taskId": "CREATE-SUMMARY-MD",
      "title": "Create human-readable markdown summary with full PR detail",
      "status": "completed",
      "owner": "triage-lane",
      "dependencies": [
        "CREATE-DISPOSITION-PLAN"
      ],
      "inputs": [
        "Per-PR disposition analysis (47 rows)"
      ],
      "outputs": [
        "ASB-2026-09-stale-pr-triage-01.md with full detail"
      ],
      "acceptanceCriteria": [
        "Counts by disposition",
        "Cluster summaries (July GNHF, Aug harness, Sept floor, current)",
        "Full per-PR rows with number/title/disposition/rationale/containmentProof/nextAction",
        "Top 5 operator actions",
        "Proof ceiling stated",
        "No secrets/machine paths",
        "No trailing whitespace (git diff --check clean)"
      ],
      "evidence": [
        "summary.md created with 47 PR disposition rows",
        "Trailing whitespace stripped"
      ]
    },
    {
      "taskId": "UPDATE-REGISTRY",
      "title": "Update plan-registry.json to register triage plan",
      "status": "completed",
      "owner": "triage-lane",
      "dependencies": [
        "CREATE-SUMMARY-MD"
      ],
      "inputs": [
        "plans/plan-registry.json current state",
        "TRIAGE-01 plan metadata"
      ],
      "outputs": [
        "Updated plan-registry.json"
      ],
      "acceptanceCriteria": [
        "TRIAGE-01 entry added",
        "Dependencies: POST-PPP-REMAINING-SPRINTS",
        "Status: active",
        "Sole-writer discipline honored"
      ],
      "evidence": [
        "plans/plan-registry.json contains active ASB-2026-09-STALE-PR-TRIAGE-01 entry on head d0e175c4545f2a76331f08c606429da5c4711d41",
        "Public plan and startup readiness contracts workflow 35457635946 succeeded on that head"
      ]
    },
    {
      "taskId": "VALIDATE-PLAN",
      "title": "Run public plan contract validation",
      "status": "completed",
      "owner": "triage-lane",
      "dependencies": [
        "UPDATE-REGISTRY"
      ],
      "inputs": [
        "Plan artifacts",
        "tests/test_public_plan_contracts.py"
      ],
      "outputs": [
        "Validation PASS or structured failure"
      ],
      "acceptanceCriteria": [
        "tests/test_public_plan_contracts.py PASS",
        "git diff --check clean",
        "No secrets in tracked files",
        "Schema compliance verified (no additionalProperties)"
      ],
      "evidence": [
        "Public plan and startup readiness contracts workflow 35457635946: SUCCESS",
        "Automated test floor workflow 35457635944: SUCCESS",
        "App harness validation workflow 35457635906: SUCCESS",
        "All seven observed exact-head workflow runs for d0e175c4545f2a76331f08c606429da5c4711d41 completed successfully"
      ]
    }
  ],
  "validation": [
    "python tests/test_public_plan_contracts.py",
    "git diff --check origin/main...HEAD"
  ],
  "proof": {
    "target": "Static triage plan artifact with evidence-based PR dispositions",
    "achieved": "Per-PR disposition assignments (47/47) with containment evidence; closed-schema plan shape; exact-head public-plan, automated-floor, app-harness, protocol, launcher, context-engine, and runtime-event workflows green on d0e175c4545f2a76331f08c606429da5c4711d41; initial plan merged to main as 067efa298953d8454f1eaf31c07dd8f4098bfc3c",
    "ceiling": "Static/provider-validated coordination plan only. Does NOT prove PR close authority or operator approval, actual stale-PR closure, rebase execution, merge of #309/#311, live system state, or runtime behavior."
  },
  "handoff": {
    "nextOwner": "Repository operator",
    "nextCommand": "Review ASB-2026-09-stale-pr-triage-01.md; approve close-candidates; execute recommended actions",
    "notes": [
      "Disposition counts: keep=2, rebase=2, superseded=6, close-candidate=37, blocked=0",
      "KEEP: #309 (FM-ASB routing builder - active Phase 3), #311 (P67 OpenCode plan draft - waits on #309)",
      "REBASE: #154 (operational harness - CONFLICTING), #159 (coordination floor - CONFLICTING)",
      "SUPERSEDED with containment: #96-#101 (FirstMate - absorbed by PR #308 faac296; PR body explicitly marks for closure)",
      "CLOSE-CANDIDATE: 17 July GNHF era (#5,#7,#10-#18,#20,#23-#24,#28-#29,#41 - roughly two months old at the Sept 19 floor; predate ASQ-004 Sept floor) + 20 Aug harness/Android era (#59-#60,#62,#64,#70-#71,#73,#79,#92,#94-#95,#102-#104,#106,#112-#114,#117-#118 - Herdr abandoned per 7c7f2da, harness evolved)",
      "Full per-PR disposition detail with number/title/rationale/containmentProof/nextAction in ASB-2026-09-stale-pr-triage-01.md",
      "Containment evidence: PR #308 body (FirstMate #96-#101), PR #288 ecea397 (WSL #11/#17), PRs #21/4c5c902 + #145/d2bafc7 (DeepSeek #13), PR #144/5ea7ce4 (Codex #117), commit 7c7f2da (Herdr #95/#102-#104)",
      "Operator approval required before closing any PR",
      "Superseded PRs have containment commits cited",
      "Close-candidates have obsolescence rationale",
      "Rebase-needed PRs have conflict evidence (gh pr view shows CONFLICTING)",
      "No PRs closed, merged, commented, or rebased by this plan - advisory only"
    ]
  }
}
