{
  "schema": "agentswitchboard.public-plan.v1",
  "planId": "ASB-2026-09-FM-ASB-OBSERVATION-ADAPTER",
  "title": "FirstMate to ASB observation adapter phase map",
  "repository": "EndeavorEverlasting/AgentSwitchboard",
  "visibility": "public",
  "status": "active",
  "priority": "high",
  "createdUtc": "2026-09-15T01:00:00Z",
  "updatedUtc": "2026-09-15T02:00:00Z",
  "mission": "Own the FirstMate fleet-snapshot to asb.agent-observation/v1 translation seam through implementation, mainline integration, Admin Box adoption, and honest live-observation proof ceilings without becoming a second crew watcher.",
  "owner": {
    "surface": "FirstMate observation adapter",
    "role": "runtime-proof / protocol bridge lane",
    "agent": "Cursor Agent (Admin Box 1)"
  },
  "delivery": {
    "branch": "chore/fm-asb-observation-live-proof-cite-20260914",
    "pullRequest": null,
    "baseRef": "main",
    "commitRequired": true
  },
  "wave": "FirstMate↔ASB↔PromptKit boundary",
  "lane": "observation adapter + live proof",
  "dependencies": [
    "ASB-2026-09-FM-ASB-PROMPTKIT-PROTOCOL-V1"
  ],
  "safeParallelWork": [
    "FM-WSL-12 Admin Box physical-floor observation",
    "Unrelated Windows profile or OpenCode LSP work"
  ],
  "ownedScope": [
    "tooling/firstmate/harness/observation/**",
    "tests/test_firstmate_agent_observation_adapter.py",
    ".ai/harness/fixtures/fm-asb-promptkit/firstmate-fleet-snapshot.valid.json",
    ".github/workflows/fm-asb-promptkit-protocol.yml observation steps",
    "plans/active/ASB-2026-09-fm-asb-observation-adapter.*",
    "plans/plan-registry.json membership for this plan"
  ],
  "forbiddenScope": [
    "fm-send / fm-control / tmux probing as ASB ownership",
    "new ASB watcher or scheduler",
    "Prompt Kit routing adapter implementation",
    "context-pressure automation / automatic rollover",
    "committing machine-local receipts, secrets, or personal FirstMate home state",
    "personal save/account mutation"
  ],
  "expectedArtifacts": [
    "emit_agent_observation.py",
    "synthetic fleet-snapshot fixture",
    "adapter regressions",
    "local untracked runtime-proof receipt for live observation attempts",
    "this public phase map"
  ],
  "tasks": [
    {
      "taskId": "OBS-01",
      "title": "Implement snapshot→observation adapter with privacy/idempotency bounds",
      "status": "completed",
      "owner": "observation adapter lane",
      "dependencies": [],
      "inputs": [
        "Frozen asb.agent-observation/v1",
        "FirstMate fm-fleet-snapshot.v1 shape"
      ],
      "outputs": [
        "emit_agent_observation.py",
        "fixture",
        "tests"
      ],
      "acceptanceCriteria": [
        "Deterministic translation of one selected task",
        "Hashes worktree paths; excludes raw status/transcript/decision text",
        "contextPressure left null for later phase"
      ],
      "evidence": [
        "PR #204 merge 5187195382584787bf30c7043660d74327549cd7"
      ]
    },
    {
      "taskId": "OBS-02",
      "title": "Admin Box adoption of integrated Phase-2 adapter",
      "status": "completed",
      "owner": "Admin Box 1 runtime-proof lane",
      "dependencies": [
        "OBS-01"
      ],
      "inputs": [
        "AgentSwitchBoard-Live checkout",
        "origin/main containing 5187195…"
      ],
      "outputs": [
        "Refreshed main containment proof",
        "Synthetic adapter + protocol validator PASS"
      ],
      "acceptanceCriteria": [
        "merge-base --is-ancestor 5187195… HEAD succeeds",
        "python tests/test_firstmate_agent_observation_adapter.py PASS",
        "Test-FmAsbPromptKitProtocolContract.ps1 PASS"
      ],
      "evidence": [
        "Live checkout validated at af7f0130a6bae93e3e949d4006c7b7bc57e7724e; tip later advanced with containment retained"
      ]
    },
    {
      "taskId": "OBS-03",
      "title": "Disposable-home live FirstMate emitter → ASB observation",
      "status": "completed",
      "owner": "Admin Box 1 runtime-proof lane",
      "dependencies": [
        "OBS-02"
      ],
      "inputs": [
        "FirstMate pin b182d0f908b78d08c7ccb8dce3775bdca8c5d657",
        "User-local jq",
        "Disposable FM_HOME seed"
      ],
      "outputs": [
        "live-fm-fleet-snapshot.json",
        "live-asb-agent-observation.json",
        "runtime-proof-receipt.json"
      ],
      "acceptanceCriteria": [
        "Real fm-fleet-snapshot.sh --json emits fm-fleet-snapshot.v1",
        "Adapter emits asb.agent-observation/v1 with key parity to frozen fixture",
        "Privacy grep finds no raw status/detail/worktree path leak",
        "Protected synthetic adapter tests still PASS"
      ],
      "evidence": [
        "%LOCALAPPDATA%\\AgentSwitchboard\\runtime-proof\\fm-asb-observation\\20260914T204242Z\\status.txt = LIVE_SNAPSHOT_TO_OBSERVATION_PASS",
        "eventId evt_fmobs_7d93f1af8437fe8ac6f9f4fe phase=unknown (honest crew-state unknown on disposable seed)"
      ]
    },
    {
      "taskId": "OBS-03b",
      "title": "Clear false WSL distro-probe 30s ceiling blocking Admin Box floor",
      "status": "completed",
      "owner": "FM-WSL-12 / observation dependency repair",
      "dependencies": [
        "OBS-03"
      ],
      "inputs": [
        "Admin Box cold/warm wsl --distribution Ubuntu --exec true latency 39-67s+",
        "PhysicalFloor Min(30, PrerequisiteTimeoutSeconds) false ceiling"
      ],
      "outputs": [
        "PR #278 timeout honor + Asq017/oneshot/harness wiring"
      ],
      "acceptanceCriteria": [
        "Distribution probe honors PrerequisiteTimeoutSeconds up to 300s",
        "NEXT=increase timeout is truthful",
        "Focused gate + observation regressions PASS"
      ],
      "evidence": [
        "merge fa5b9be7d4253b4791565454ed7a9cebe4f3b6c5 pr:#278"
      ]
    },
    {
      "taskId": "OBS-04",
      "title": "Operator/crew live observation (non-disposable home)",
      "status": "blocked",
      "owner": "Admin Box 1 operator / FirstMate runtime",
      "dependencies": [
        "OBS-03b"
      ],
      "inputs": [
        "Authorized FirstMate home with live task OR FM-WSL-12 physical-floor PASS"
      ],
      "outputs": [
        "Local receipt bound to live taskId"
      ],
      "acceptanceCriteria": [
        "Snapshot sourced from operator/crew FM_HOME (not disposable cache seed)",
        "Observation emitted without privacy leaks",
        "Proof labeled OBSERVED_OPERATOR_CREW only when live task is real"
      ],
      "evidence": [
        "ASQ-017 live attempt operator-crew-20260914T215535Z RESULT=BLOCKED_GITHUB_AUTH exit 45 after user-local gh install; no $HOME/firstmate operator metas; disposable protected control still PASS"
      ]
    },
    {
      "taskId": "OBS-05",
      "title": "Phase 3 handoff — Prompt Kit routing adapter",
      "status": "pending",
      "owner": "Prompt Kit routing adapter lane",
      "dependencies": [
        "OBS-04"
      ],
      "inputs": [
        "asb.agent-observation/v1",
        "Frozen routing-request/decision schemas"
      ],
      "outputs": [
        "Bounded routing adapter sprint"
      ],
      "acceptanceCriteria": [
        "New bounded sprint declaration",
        "No ASB crew scheduler expansion"
      ],
      "evidence": []
    }
  ],
  "validation": [
    "python tests/test_firstmate_agent_observation_adapter.py",
    "pwsh -NoLogo -NoProfile -File scripts/Test-FmAsbPromptKitProtocolContract.ps1",
    "pwsh -NoLogo -NoProfile -File scripts/Test-PublicPlanContracts.ps1",
    "git diff --check"
  ],
  "proof": {
    "target": "FirstMate snapshot → ASB observation on Admin Box with honest ceilings",
    "achieved": "Phase-2 adapter INTEGRATED (PR #204). Disposable-home OBSERVED. Distro-probe timeout false ceiling INTEGRATED (PR #278). ASQ-017 live attempt advances to BLOCKED_GITHUB_AUTH (exit 45). Protected disposable + synthetic controls still PASS. Operator/crew observation and Prompt Kit routing remain unproven.",
    "ceiling": "OBSERVED_DISPOSABLE_HOME. ASQ-017 LIVE_ATTEMPT_FAIL_CLOSED at BLOCKED_GITHUB_AUTH. Not OBSERVED_OPERATOR_CREW. Not physical-floor PASS. Not routing/dispatch/rollover."
  },
  "handoff": {
    "nextOwner": "Admin Box operator (Ubuntu gh auth), then ASQ-017 rerun for OBS-04",
    "nextCommand": "$ErrorActionPreference='Stop'; $repo = if ($env:AGENT_SWITCHBOARD_REPO) { $env:AGENT_SWITCHBOARD_REPO } else { Join-Path $env:USERPROFILE 'dev\\AgentSwitchBoard-Live' }; Set-Location -LiteralPath $repo; git fetch --all --prune --tags; if (git status --porcelain) { git status --short; throw 'Checkout dirty; preserve work before continuing.' }; git switch main; git pull --ff-only origin main; git merge-base --is-ancestor fa5b9be7d4253b4791565454ed7a9cebe4f3b6c5 HEAD; if ($LASTEXITCODE -ne 0) { throw 'Distro-probe timeout fix not contained.' }; wsl.exe -d Ubuntu -- bash -lc 'export PATH=\"$HOME/.local/bin:$PATH\"; gh auth login --hostname github.com --git-protocol https --web; gh auth status --hostname github.com'; $ev = Join-Path $env:LOCALAPPDATA ('AgentSwitchboard\\runtime-proof\\fm-asb-observation\\operator-crew-' + (Get-Date -Format 'yyyyMMddTHHmmssZ')); New-Item -ItemType Directory -Force -Path $ev | Out-Null; $fmPath = '/home/pa_rperez26/.cache/asb-fm-observation/firstmate-b182d0f908b78d08c7ccb8dce3775bdca8c5d657'; pwsh -NoLogo -NoProfile -File .\\Invoke-Asq017AdminBoxLiveFloor.ps1 -SkipGitRefresh -FirstMatePath $fmPath -EvidenceRoot $ev -PrerequisiteTimeoutSeconds 180; $childExit=$LASTEXITCODE; Write-Host \"CHILD_EXIT_CODE=$childExit\"; if ($childExit -ne 0) { throw \"ASQ-017 failed with exit $childExit\" }",
    "notes": [
      "Do not claim operator-crew OBSERVED from the disposable-home receipt.",
      "Do not automate gh auth or capture tokens in evidence.",
      "Machine-local evidence stays under LOCALAPPDATA; never commit receipts.",
      "Phase 3 is Prompt Kit routing, not ASB crew scheduling."
    ]
  }
}
